{
  "branch": "develop",
  "required_status_checks": ["Build, test, validate", "Apply and verify (dev mock)"],
  "strict_status_checks": false,
  "require_pull_request": true,
  "required_approving_review_count": 0,
  "require_code_owner_reviews": false,
  "dismiss_stale_reviews": true,
  "enforce_admins": false,
  "required_linear_history": false,
  "allow_force_pushes": false,
  "allow_deletions": false,
  "required_conversation_resolution": true
}
